title,text
Wiskurpa kapchichin,"Huk hunaqshi, suqu atuq hirkakunapa purikuykaanaq, paqway pachan tinku, utishqanashi hamakurinaq. Hatun qallunwan llaqwapaakuykaptinnashi (laqwapaakuykaptinnashi), hatun wiskur ñawpan qaqaman shaakurinaq, wakman kayman rikachaakur. Atuqnashi, manchakashqa, aayakashqa rikaraanaq, wiskurpa chakinta rikarnashi, ninaq: —Yanasa wiskur ¿Imanawllataq kaykanki?, ¿yamayllaku? —Awmi, yanasa, yamayllami kaykaa— wiskurnashi ninaq. —Kushikullaami, yanasa, alli kaykanqaykita kapchichiyniykiqa, muuchuykichi (mawchuykichi) apaykamuuman. —Chaynaw kaptinqa, rurapaarishqaykichi, ¿chiwa qarayki (qaratsayki) kanku? —Awmi. Wasiichaw (wayiichaw), qarallaqa kanmi. —Chayqa, kanan wasiykiman chaarir, hatun chiwa qaraykita (qaratsaykita) ushmarachinki, warayna shamunki quya-quyalla, ñuqanami wakinta ruramushaq. Waraykamana, yanasa, —nishpa—, hiqarinaq (aykunaq) paarirnin. Atuqnashi wasinman chaarir mullumullu chiwapa qaranta akrarir ushmarachinaq kapchichipaq yarparar. Atuq mana puñuytapis tarinaqtsu. Waraariptinnashi alli aychakunata mikupaarir uqu qaratsaman uushapa chankanta shunqurkachir; llapanta katakurkur (apirikurkur) wiskur ashiq hiqarinaq. Inti hirkakunaman rataraykaptinnashi, hatun qaqachaw, wiskur rikachakur kaykaanaq. Atuqta rikaarir qayanaq: “¡Atuq, kayllapa shamuy!”. —Yaw, yanasa, chaarallamuumi. Kay aychallaykimi apamurquu, ichikllatapis llamiriykuy. Kaymi qaratsallaa allimi ushmarachirquu. —Allimi kanqa. ¡Maa, apamuy! Aychallataqa kapchichiykita usharirnami mikurillaashaq; ñawpataqa maa qaratsataraq kutsushun (ruqushun), tupunaapaq kay palta rumillawan iskakaariy (mashtakaariy). Atuqqa llapan wiskur ninqanta ruranaq upaallalla, piqanchawnashi hiruruq huk shumaq atuq kapchichirishqa. Wiskurnashi, atuqpa ishkan chakinman qaratsata hirarir usharirna ninaq: 144 —Usharallaamurquunami, kananqa ura pampaman ayway, chaychawmi tarinki hatun palta qaqata, chayman lluqarkur hitaray. Achachaywanmi shumaq rurakaarinqa kapchichiyki, mushuq qara inkukar qallaykuptin qachwanki (qatswanki) kaynaw nishpa: —Kapchichi, kapchichi, kapchichi, kapchichi. Hinallachaw, ayway. Yapaynami tinkutishun. —Ñuqallaanachi, imallachawpis yanaparishqayki, aywakullaa allaapa kushishqami. Chayta niriykur, pintillapa atuq hiqarinaq palta qaqaman. Wiskurna uushapa chankanta mikur qallaykunaq. Atuqnashi, qaqachaw hitaraykar tillaqshar sharikurkunaq, yanasan nishqanta yarparkur qutsur qallaykunaq qachwaraykar (tushuraykar): kapchichi, kapchichi, kapchichi —nishpa— hina chaychawnashi achachaywan chiwa qaranqa paqway kichkikaakurkunaq, atuqqa hina qutsuqllana, qatswaqllana chankan nanaykaptinpis mana yarpachakushpa. Yawarninpis hinashi yarqur qallaykunaq ishkan chankanpita. Chaynashi kayqa, kaayikunaq kaynaw nishpa: —Supaypa wawan, wiskurqa chikimarniichi kaytaqa ruraykallaamashqa; kaychawraq kaykanman haqchir haqchir ushakarachinaapaq. Chay llapanta nirnashi kapchichintaqa haqchir haqchir quturinaq, chankallankunaqa paqway yawarchashqashi kanaq. Chayta rikaykurqa llakishqashi, waqwaq, waqwaq —nishpa—, wikrut wikrut hirkakunapa illakarillaanaq."
Allqukunapa willakuynin,"Zambowan Wanka karupita shayaamunaq. Chuyanchashpa rimanapaq: Simón Robles apamunaq. Allaapa llullullaraq kayarqan, ñawinkunapis wichqashqallaraq. Huk pukrupa kallkinchaw shuntukashqa aywayaanaq, kay pukrutaqa huk chawhir (kaaru pushaq) punchupa kuchunta piturkurlla ruranaq. Maa kaaru shuqshinqanllatapis (kuyunqanllatapis) maakuyaanaqtsu. —Juana, allqukunataaaaaaami… apamuu —Simón Robles qaparirqan, wasinman chaaraykar. Payqa chaskiq ayqirqan, niykur chikuman apanaq. Llullu wamrakunapa rurinchaw, chuschukunaqa llullu kasharaq chuchukunata (chichikunata) achka (atska) hunaqyaypa chaychaw chuchuyaanaq. Runaqa michikuq allqupa kikin mamanpa chichinta chuchunanta munanaqtsu, manachayqa uushata chichinanta munar payqa quykunaq. Chayraykur chay allquqa uywakunawan wiñanaq. Chaynawpa, yanaqinchik allquqa, ñawinkunata kichariyaanaq, niykur tinkuriyaanaq ruyru (muyu) yuraq ashmakunawan. Hinaman kaayiyaanaq, uushakuna, paykunapa kawayninkuna qanqanta. Niykur, china kaq llullu allquqa yachakunaq puriyta. Niykur chankakunawan tinkunaq, chaynawpa wanupa hananman lluchkaykunaq (lutskaykunaq). Maa uushapa waqachaynin urusninkunata llawarichinaq (qiririnachinaq). Yachapayta munarqan mana yarqupakunaqtsu, manachayqa aninaq (waqyanaq). Ichanqa llullu waqyayninqa achkashta manchakaachinaq, chaynawpa huk uushata rakirichinaq. Chaynawpa, uushakunapiq, huk laaya qanqanta maakunaq. Imanawkarpis, chuchunqa (ñuñunqa) allaapa alli kanaq qatiykuryan chuchukunanpaq. Kawaymi, imaykapitapis, allaapa alliqa, uushakuna kawaynin quyaq. Chaynawpa, wawqinpis ichikllapayan kaayir qallaykunaq. Ñawinkunapa kichaynintaqa Vicentami kushikuyllapami sumaachinaq (raymichinaq), chay wichankunapami michikuq karqan, hinaman Antukapapis. Allqukunata wasitami apayarqan. —¿Ima shutinkunataq churaykunchik? Simón Robles ninaq: —China kaq allqutaqa Wanka churaykushun. Timoteo kaq runana nirqan: 146 —Yanasku kaqqa Zambo shutikutsun. Chay shutishqana tikrariyaanaq. Shutinkunaqa kaayipaqmi kanaq, Wanka kaq allqupitapis chiqchimanmi (suqumanmi) niraq, ¿ichanqa kay kaqqa? Imanaw karpis, Simontaqa pipis tapuqtsu imaraykur chay kuyay shuntin kanqanta. Kikinpis, icha, musyanaqtsu. Wankaqa allaapa sinchiyuq kaq inka patsapiqnawpis. Chay shimiqa, manaku, qasqupiq yarqurqan arwachaw quyllur yarqamuqnawpis. Wankawan Zamboqa uushakunawan hina Robleswan kuyanakushpa wiñayarqan. Ñawinkunaqa ichikllaypayan hunaq-hunaq achiksaqtana hina karumanna rikaayarqan. Waataqninkunapaqa chullqa niraq qarankuna kayaapurqan. Simónwan Juanaqa ichik qurukashqa puriyaq. Timoteoqa punchunta hakachiq hatun qasqun qanqanraykur. Vicentana shayllapa (ichiyllapa) puriq, imatapis raslla (ankashlla) rurapakuq, paymi llapan michiykuna ruraykunatapis yachachiq. Ichanqa Antukawanmi yachapaanakuyaq, ichikllallan ahalla kaq. Hallqakunapiq kutimuqta shuwaraq, niykur chikuchaw taapakuqkunapa chukllankunata aykuq. Maqanakushpanawmi pukllaykuyaqnaaqa. Antukaqa kuchinaw waqachakushpanaw laqyaq, paykunana ashkaqnawpis, maqaqnawpis. Chay uushakunapis maqanakuqnawta patsaypa manchaqashqanawpis rikaraayaq. Hinamanpis kikin suyuwanpis yachakaayaq. Waataqninkunapa wasinkunaqa hirka chakinchaw achka hachakunawan rurinchaw kaq. Washaninchawna ichik hirkakunapa pachanninchaw, chakrakunapiq ruyrushqa, nitishqa wasikuna rikakamuq. Wak chimpanchawna anqaslla hirkakuna rikakamuq. Wankawan Zamboqa chaypa aywaytaqa yuyayaanaqpistsu (yarpachakuyaqpistsu). Karu, quru-quru qaqakunawan naanikuna kaq, chaykunapaqa uushakunata manami haqipaqtsu kaq. Kawayqa allimi kaq. Wiñaykaayaqmi. Hatunyashqana kayaanaq. Llapshawan chikchi rinrinkunaqa ima kaqtapis maakuq maakuqlla kaq. ¿Kasta? Chaypiqqa ama rimashuntsu. Perú runakuna suyukunapanawpis takushqami. Chay allqukunaqa hirkakunapa qurpankunaqa chaynawllatsu kayan, manachayqa uchukllallan, mishwasapa (saqwasapa), llullu shimilla aniyninpis kaq. Wankawan Zambochawqa Ispanukunawan kay suyukunawannawpis takunakun, Simón Robleschawwan llapan runakunawannawpis. 147 Simón Roblespa uushankuna miray patsamanna chaarirqan (qallaykurqan), chaypaq achka taapaqkunata wananaq, hinaman Antukapis waatakunata waatananpaq patsapis charamurqanna, payqa alli wiñarishqana kanaq. Chayraykur Simón Robles nirqan: Wachay shamuqpitaqa, ishkay allqutachi ñuqanchikpaq rakishun. Paykuna kayarqan Tulluwan Qaratsa. Kikin Simónmi chay shuntinkuna churarqan, chay shutikuna churaypaqwan willakuykuna ninanpaqqa allimi kaq. Ashmankunatawan runakunapa kuyay shutinkunata churaq. Huk shipash waynakur tumallita (purikuqta) “Mana ashmayuq michikuq” nishpa churarqan, huk qasma chuulutana “Yawachaw (ayuna nishqan) mana tunruruq (tanraraq)” shutichirqan. Huk wirasapa kawallutana “Wayrata putsuq”, huk wallpa mana churaquqtana “Wayrallata churakuq”. Mirindachawna (chisi mikuychawna), allqukunapa shutinkuna churaychawna nirqan: —Chaynaw shutikuyaatsun, chaypaq huk willakuymi kan: huk chakwaspashi ishkay allqunkuna kapunaq, huknin Tullu shutikuq, hukninpanashi Qaratsa. Huk hunaqnashi kay chakwas wasinpita kay allqukunawan yarqunaq, chaymanna huk suwa chaakuykunaq, niykur kawitupa (kamanpa) rurinman yaykukuykunaq. Ampipanaw (tutapana) chakwasqa kutinaq, niykur patsaakunaq (puñukunaq). Suwaqa chaychaw upaallala (chulluklla) kaykaanaq, chakwas puñunkanyaq, allqukunapis mana maakuyaananpaq, qillayyuq kahunpa llaawinta (llave nishqan) tarinanpaq. Chakwas ishpanar ishpanata (ishpay qurina) ashir muchkinqanchaw suwapa chankanta rikaykunaq. Llapan chakwaskunanawpis milay (mañuusa) kanaq, paypis chaynaw kanaq. Chayraykur yarpachakuq mana munaqtukuqnawpis: “Allaapa chakwasnami kallaa. Aa allaapa chakwasnami hinaman allaapa tullunami kallaa. Tulluwan qaratsallanami kallaa”. Ayrayashqanawpis achka kuti qaparipa kutipaq: “¡Tulluwan qaratsa! ¡Tulluwan qaratsa!”. Chayta wiyaykur allqukunaqa ayqipa shayaamurqan. Maa payqa makinwan kurqanaq (kachanaq), chayraykur allqukunaqa suwaman kaniqnin witiyarqan, patsaypa tsiqtatanawpis rurariyarqan. Kaykunaqa allimi Tulluwan Qaratsa shutikuyanqa. Chay willakuy (llapan ruraykunata) sumaachiyarqan, hinaman shutikunapis alli kanaq."
Rukuswan Inti,"Intishi rukuspa (pichakpa) haqan kanaq. chayshi, rukusqa unayna kubrakuq aywaraanaq. Chaynaw, achka kuti aywaykarpis manashi intitaqa tarinaqtsu, rikaqtsu. Intiqa quya quyallashi yarqukuq. Chaynashi rukusqa (pichakqa) allaapa ahayashqana kanaq. Kutirir, kutirir aywaykarpis mana intita tarirnin. Chaynashi ninaq: —Achka (atska) kutina aywaa intitaqa tariitsu. Tarirninpis yarqukuykaanami niman, chaynaw haqaa qumayta (pagamayta) munantsu. Huk hunaq kutimunki niman. Chaynashi rukusqa (pichakqa) alli, alli yarpakachaariykur kakashman tapukuq aywanaq. Payta llapanta willanaq. Kakashnashi rukus willapanqanta wiyariykur, niykur yarpakachaarir, rukustaqa nishqa: —Ñuqa qutsunqaa (takinqaa) uura aywanki, chaymi shapranta hichkakuykaptinllaraq tarinki. Chaynawmi haqayki kutichishunaykita tinkuchinki. Chaynashi rukusqa kakash ñawpa qutsunqan uuralla aywakushqa, ras raslla intipa wasinman chaarishqa. Chaynashi aanir intitaqa shapranta hichkapaakur, hichkapaakur yarqaraykamuqllataraq tarishqa. chaynaw taripakuykurnashi intiqa nishqana: —¿Pitaq willashurqunki kay uura tarimaanaykipaq? Chaynaw niptinnashi, rukusqa kakashpa anyayninta (willapaakuyninta), willarishqa: —Kakashmi nillaamashqa: “Ñuqa ñawpa qutsunqaa (takinqaa) uura yarqunki, chaymi intitaqa shapranta hichkakuykaptinllaraq tarinki”. Chayta wiyaarirnashi, intiqa piñashqana nishqa: —Chaypinqa... manami ñuqapa tiyimpuu kantsu kanan uura haqaykita kutichinaqpaq. Ayway, kutiykur wip (ras) kakashta mikunki, haqaapita. Paypis ñuqapa haqaami. Chaynashi rukusqa (pichakqa) allaapa mishkipaakur, kakashta mikuyta munarllana kutishqa. Chaykur uuranashi, kakashtaqa mana imata nishpa (willashpa) raslla mikurishqa, maakushqapis mana kaqtana. Chaynawshi kakashta mikunqanllawanna intipa haqan ushakaarinaq."
Shuqpi,"Kay willapa, mana kaq niraqmi kaykan. Llutankunami mana yarpaytapis atipay niraqpatsu. Kaykuna sasa tantiyaymi, manami musyankimantsu, alli kanqantaqa, hina mana alli kanqanta. Ninkichi kay ruraykunata unaypitanami kan. Runakuna kayta mirachipakunaq hampipakunanpaq. Shuqpipitami rimaykanchik, kayta unay runakuna rurapakunaq markankunachaw. Yachaqkuna kayta hampimi nipakuq. Chay ruraqkuna, Marañun mayu hananchaw, Huamalíes markachaw yachapakuq. Wakin runakuna, Hirkan markachawpis yachapakuq. Ñuqakunaqa, imanawpa rurapakushqanta achka kutishmi rikapakushqa kaa. Ñuqanchikta chay rurayninkuna manchakashqa haqipakamashqa. Chay shuqpiqa sasa rimaymi Castilla shimichaw. Chaytami qichwachaw ñuqanchik ninchik: shuqmay, hina chaytaqa wakin runakuna, tsaqa lluta ruraykunami nipakumanchik. Wakin runakuna, kay rurayta, riqipakuyan kay shutiwanmi: qaqukuy, chay shutin yurimun kikin qaqukuypita. Hampikunqanchikchaw, kaytaqa, hakawan qaqukuy ninchik, wakin hampikuqkunaqa, kay shutinwan riqipakuyan. Ichanqa may alli kawaq runakunapis, hatun markakunachaw, Perú chinchay suyunchaw kayta alli hampi nir yupachikarin. Chaymi kay hampikuqkunaman aywapakunaq, hampichikurinanpaq. Wakin runakuna, punta yachaqkunaqa, amatami kay rurayta, unay unaypitanami hampikarin, chaypa shutinmi kaykan: Shuqpi. Chay shuqpita ruranchik qishyaq aw mana alli kaqkunamanpis. Runapa llapan kurkunpa hanallanpa hakawan pasachinchik (chaymi nipakun, unayshi tayta inka kayllawan hampikuq. Payshi killata ushaykaptinna hukpita qaquchikuq), kay qaqukunqanwanqa, kawaq uywawanmi qaqukunchik. Chaytami qaqukuq runa, shumaqmi tinkuchin, ñuqanchikpa kurkunchikwanmi. Kurkunchik nananqanchawmi churapakamanchik, chaytami kutirir kutirir, chaynawpami qaqupakamanchik (kupapamanchik). Qaquyta qallaykaarinanpaq kukataranmi chaqchapakun, pitanakunatapis (cigarro nishqantapis) shumaq mukapakun; shaqtantawanpis upyapakurinrami, niykurmi qaqupakun (kupapakun). Chaypitana hampikuq hakata qaqunta waratsaq. Chaytami shumaqllapa rikapaykur rikapaykur ruran; niykushpami hukpakama rikan. Maychawmi nanay kashqanta musyananpaq aw manachi. Chaytami hakapa kawaqninchaw (aorta nishqanchaw) imaykama qishyananta, kawananta, wañunanta rikapakun… 150 Hampikuqkunaqa, shuqpita wakin uywakunawanpis rurapakun, ichanqa hakatami yupachikuriq, shumaq alli manshu kashqanta rikaarir. Niykur haka chuqaptin musyapakuq rahunanta. Chay haka uywaqkuna musyapakun mishki aychan kanqanta. Haka kayman, wakman raslla pichukachikarin, hina haka achisyaptin, chawrasqa tamyamunqanami nipakuq. Chay shuqpikuq runa, musyanmanshi. Maypa yupachikunanmi kaq. Chaynaw kaptinmi pipis niq. Kaymi alli hampikuq runa nipakun, kaymi riqikuq kaykan. Chaypitami wakin runakuna, paytami yupachikuriq. Chaymi pay niq: wakin runakuna, ñuqata musyanqanta mana yupachikuriptin, hina kikillaata haqipaykamaatsun; mana yupachipakumarqa, washachaw, manami imatapis rimapakunmannatsu. Alli kaqta, kay rurayninchik, allimanmi churanchik mana runa hamurpananpaq. Ñuqa niraq hampikuqkuna, alli hampikuqmi kanman, mana wakin runakuna ashllipamananchikpaq, mana pipis hamurpananchikpaq. Hakatami hampinanchikpaq, ullqu runa kaptin, urqu hakatami ashinchik; warmi kaptinqa, china hakatami ashinchik. Yana hakami alli kaq. Yana haka mana kaptinqa, huk llimpishqa hakata ashinchik. Chay hakataqa, huk hunaqninpimi mikuchikchiknatsu. Qishyaqqa ichik churakunallawan shuwaran chacharayllapa puñunanchaw. Hakatashi qishyaq puñunqanchaw runkuman winarkur ashuykarinchik (witirachinchik). Qishyaqtami willapanchik manana imatapis mikunanpaqna, chay hunaq qishyaq runaqa hampikan, manashi puñunmantsu. Rikchaq rikchaqlla (riyaq riyaqllashi) kanman, hampikuyta ushashqankama. Chaymannami naqana llapan ima munashqanta kamariparqariptinqa, shuqpikuq yaykuq qishyaq kashqankamaq, niykur rimaq, mama patsata mañakuq; qallaykuq kukata yapay yapay chaqchariyta. Ichaqa hampikuqshi, imay patsamannaw hampikuq, payllashi musyaq shuqpita qallaykunanpaq; chayqa kukapitaraqshi, kuka ashqayaptin, kuka mishkiptin musyakan, manachayqa kukapa ichik rapinkuna, ayka kutishi qallunta tukshishqanaq; chay ishkay, kimsa chaqchanqan mana alli aywaptinshi, naypiwanpis rikaq. Hinaman dadukunawanpis tapunshi. Pikunatapis tinkuchishpa hampikuqqa alli musyananpaq, qishya kutikunanpaqpis ruran. Naqana alli kaptinaqa, hakata runkupita hurqurirqa mañakuq, alli hampinanpaq; niykur hakata qishyaqpa shiminwan hamayninta churananpaq niq. Kikinpis hamayninta puukaq. Nirkurnashi chayta rurarkurqa qishyaqpa llapan kurkunta hakawan shumaqllapa qaqukuyta qallaykuq; rikrapurashi, umapurashi may imantapis qaquq. 151 Chay qallaykushqanpitanami musyakaq, haka chuqaptinqa qishyaqpa puywayninshi mana alli kaykaq. Haka antsaptinqa hinaman nanachikuptinqa, chawrasqa, tukuy qishyawan kaykanqantashi musyaq. Chunka ishkayniyuqnin kutimi kupamanchik llapanta musyapaarir, hina imanaw kashqanta. Kupakuyta ushaparinanpaqna, pichqa patsa waraykamuptinna kanman. Patsa achikyaykaptin warachaytanami (waratsaytanami) qallaykunaq. Chawrasqa shumaq musyayninwanna haka pishtayta qallaykunaq. Hina chay ruraq, haka qaqunqan kawaptin, itsa alli qishya rikaachikuqqa haka wañukurinmi; chawrasqa musyakan alli hampi kashqantami. Tukuy qishyatami hakaqa hurqun: puywan nanaptin, pacha nanaynin kaptin, rurun nanay kaptinpis, aqishnin nanaykaqtapis, wakllikashqa pachatapis, muyukashqa pachatapis hampinaqshi, hina tallukashqa chunchullinkunatapis hampiq. Hampikuqshi llapan ima aykantapis, shumaq rurapakaq, niykurshi kawayninta willakuq. Pacha pulltutuptin, yawar niraq rikakakaptin, hampikuq nin: kawananpaqpis, wañunanpapis, manashi kay shamuq killa kawanqanatsu. Llapanchikmi chaychaw kaq musyanchikmi. Rikanchikpis haka pishtanqanta; ichanqa qishyaqqa manami musyanmantsu. Musyayta munarqa isqun riyaltami millpuqnichaw churan. Chaytana, imaparaq churakarinchik. Hampiyta ushapakuptinnami hakata pampapakun. Markakunachaw yachaqpa, tukuymi ruraynin kan, chayta musyarirqa ukakashqan (aayakashqa) rikapakuu. Wakin shuqpikuqkuna tukuyninpami rurapakun. Rurapakushqankuna manami yarpaypis atipaypaqtsu, manami pipis ninmantsu alli kashqanta, hina mana alli kashqanta. Chaymi shumaq musyayta munar shuqpikuqkunawanmi alli qutukashqun mana hamurpayllapa, chaymi willapakushqayki, imanaw kashqanta, mana alli kashqantapis kay hampikuq runa atipakun. Ichikllami qillqapakushqa kay shuqpipita. Cronista runakuna wallka wallkallatami qillqapakushqa kaykunapita. Paykuna, kay rurayshi unay unaypitanashi, ñawpa ayllunchik ruranaq. Ciencia nishqanpaq kay rurakuna manashi allitsu. Ciencia nishqan huknawpashi rikaran. Paykunapaq kay shuqpi rurayqa lluta rurayshi kaykan. Paykuna nishqan yupay, shuqpi mana shumaq musyaqkunami riqiytami atipapakun, imaninpami kaykunallawam chaylla hampirapakun, imanaw kaptinpis. Shuqpimi unaypitana rurakan, chayshi alli hampin kan. Chaywan yupachikuqkunallami pasachikarin. Kayta musyaqkuna, wakinkunata yachachiq shullkankunata chayninpa hampipakunanpaq, rurapakunanpaq. Chaymi alli shuqpikuq, musyaq imanaw waray wichan aykanaw kanqanta, uywata rikarishllapami. 152 Chaymi may musyarkurpis, kaykuna manami allitsu nishwantsu, manaraqpis imatapis musyar niraq. Manatsun musyayninchikwan tinkuchishwan, mayqanmi alli aw mana alli ninanchikpaqpis, shumaq musyashwanraq. Ichaqa wakin runakuna manaraqmi shumaq tantiyantsu, shumaq musyashwan shuqpikuq runa ruranqanta. Kay rurashqankunata imaninpa rikarpis manami yachashwantsu imaninpa rurashaq nirpis. Chaymi kay ruraykunata alli kaptinmi, kanankama yupachikarin alli hampi nir, chaymi llapan markakunachaw Perú suyupa shuqpikarin. Manami chayllachawtsu kayta rurapakuyan, kay hatun markakunachawpis shuqpikarinmi, musyaqkuna imaypis chaytami musyachimanchik, alli kay shuqpi ruray kashqanta. Kananqa willapakurishqaykimi imanaw shuqpikarinqanta. Chaymi huk ayllutami hampiyta qallaykurqarinaq. Paymi disentería amebiana nishqan qishyawan kaykaanaq. Chaymi pachan nanayniyuqmi kaq, pusaq watanashi nakaykarqan. Chaymi shuqpichikurkunaq, chaytami nipakurqaa: Aqilinninmi (aqishninmi) imaypis uchkukaykannami. Ichanawmi, suqta chunka hukniyuq inyección nishqan churachimushqaykipitami chaynaw kaykan. Allaapa qishyaqman tikrashqa kanki. Chay qishyakunata ñuqaqa manami hampiymantsu, ichantaq huk hampikuqta, hinaman ampita ashirqa hampikankimanmi ninaq shuqpikuq. Maa chay nishqannawpis kawarqan ishkay chunka watata. Musyayta munar alliku karqan chay shuqpikunqan aw mana allliku karqan, chayta nir, enfermero nishqanman tapukuq aywarqan. Huknin kaq willakuyqa, yanasapa willapanmi kaykan. Payqa awkin runa kanaq; nakaq pacha nanaypita, chaymi amatashi nanachikuq. Chaytami hampikuq ninaq: Chay shunqun kaqchawmi yawar quturaykan, imaypis pashtanqami, chaymi wañunqa. Kay qishyaq runa kawanqa, suqta killakamallami, niykur wañukunqami. Maa chaynawshi kanaq. Kimsa kaq willapa musyapakurqa, huk mushuq yachakuq; paymi chunka pichqa watayuqwan kaykaanaq. Lima markapita raslla aywakunaq. Payta hampikuq wasichawshi, huk hampikuq ninaq: aqilinniykikunami pillukashqa kaykan, chaymi yurishqaykipita patsay chaynaw kaykan. Huklla, sala de operaciones nishqanman yaykunkichi ninaq. Chayta musyarkurqa, waynaqa markan kaqpa wasin kashqankaqchaw, imanawpa hampikuyta ashir aywanaq. Chayta musyarkurnashi mamanqa llakipaakurqan, maa ima ruraytapis atiparkarqantsu. Chayshi waranqa isqun pachak kimsa chunka wichan kanaq. Chaymi maman chachaykurkunaq, alli shuqpikuqta ashipakunapaq. Chaymi shamurqan huk musyaq warmi, alli hampikuq. 153 Chaymi hampita qallaykurqan, huk shuqmayllachaw mamanta rikaachirqan aqilinnintaqa hakarishqata. Maa aqilininqa allaapa mashtakashqashi kaykaanaq. Niykur hampikuq warmi nirqan: “ñuqa hampiymanmi wawaykita”, chaymi waynapa maman ninaq: “aykatapis mañamay, ima aykatapis mañamay. Huk waakatami ichik wawanwan qushqayki uywakunaykipaq”. Chay warmishi karqan kapuqniyuq. Chararaq chanin wakatashi, ichantaq hampikuq warmi mañanaq chunka sulis nishqanllatashi. Chaymi ishkan shumaq rimanakurishpa hampitami qallaykurqan shuqmakuywan shumaq kupapaykur, chaqchapaykur qarapachakurir waracharqan, niykur hakapa aqilinnintami shumaq hukllacharqan mashtakashqa kashqanpita, chaypita pamparqan wasipa punkunchaw. Chaymi waynataqa wallkallata mikachipakuq, niykur chachayllami chacharaq. Warantinpitaqa waynallaqa alliyaytanami qallaykurqan. Niykur ishkay chunka hunaqtami, hampikuq warmi, kutikamurqan musyananpaq, chaymi yapay shuqpirqan, chaywanqa shumaqnami hampikurqan waynallaqa. Hampikuq warmi aaniparkunaqshi, chayshi shumaqllapa hakapa wañushqapa aqilinninkunata, pillukashqata paskanaq; mama patsata qayarkur qayaykur chayta ruraq. Chaypitana chikuman hakata pampanaq. Waynaqa manami sharkuqtsu; ñampu mikuykunallatami mikuq. Warantin hunaq hampiqanqanpitana waynaqa alliyamurqana; killataraqmi hampikuq warmi kutikamurqan, chaymi waynataqa alliyashqatanami tarirqaa, chay shuqpi ruranpitanami waynaqa allina tikranaq. Chay wayna, kanankama kawan, mananami qishyannatsu."
