title,text
Wakchami kanchik,"Kaychawqa mana alli kawaypitaqa huyu kawaymi kaykan. Aykuq simanami tiyaa Hashi wañukurqan. Kuychi (sábado) hunaqraqmi, pampapakurkurqaa llakinaypis ichikllata karuparqan. Tamyapis qallaykurqun mana imaypis tamyanqan yupay. Chaymi taytataqa rawyanay (sinchinay) qurqun, chay llapan siwara rutushqa, shanaychaw qarwaraykamushqana. Shullay mayanipitashi chaykunaq, achka yaku chaayarqamun. Achkanpa wichanpa sharkurir sharkurir, manaraq huk aptayllatapis pakayta atipapakuptii. Chaymi llapan wasi yachaqkuna chukchunakushqalla, chukllapa rurillanchaw yaykapaakunaq; tamyami ushmashqa qarwaranqan siwarata, chayta chayllaraq rutupakunaq. Qanyanllaranmi nanaa Tacha, chunka ishkayniyuqman watachamurqan, chaymi taytaqa nanaapa santun hunaqninchaw waakaa qunqantapis, musyapakushqa kaa, mayu apanqanta. Chay mayu, tsarpamurqan kimsa paqasllata. Chay patsa waraananman, ñuqaqa, puñukashqanami kaykaanaq kaa. Chawraq tsarpuq mayu, haqraraylla, qaparir aywaptin rikachapakurqaa, chawrashqa (chaymi) kaamapita ichik qatallawan chinkamurqaa. Maytachi wasipa qatanshi qarikaykanman yupay. Chaypitaqa yapay puñuq yaykukuykushqa. Mayu haqraraylla aywaqta mayarqaa; chaynawlla mayaykar yapay puñukarqaa. Sharkunaapaqqa tutaqa pukutay pukutay chaynawlla tamyakushqa niraq kaykaanaq. Musyakarqan mayupa qaparaynin huyupaq; chaynaw chayllaman karqan. Mayu asyanaq rupashqa niraq. Ismushqa niraqpis mayu asyanaq. Chay uura mayupa kuchunta rikaq aywaptii, mayupa kuchunkunaman yaku huntamushqana kaykaanaq. Maynami hiqashqana kashqa, chay kaalli runa purinqanpa, niykur patsaypa yaykuykashqana chay Tambora nipakunqan warmipa wasinmanpis. Yakupa aywaynin mayakaq, chay chikuman yaykuptin, niykur yarqamuq achka shutuyninpa punkunpa. Chay Tambora warmiqa yaykurqan, yarqamurqan hapaypa mayu, hina aywaptinqa wallpankunata kaalli runa purinanpaq qarqamuq, chayllapa pakakunanpaq, mana yaku apananpaq. 130 Chaypitaqa, chaykaqpaqa, chay muyu kanqanpaqa mayu apakurqanshi chakata (tsakata), pitaq musyan imayshi apakurqan, chay tamarindu tiyaa Jacinta wirtanchaw kaq, kananqa manami chay tamarindu, rikanchiknatsu. Chayllami tamarindullami markachaw karqun. Chaypitami runa yarpachakun, chay wiñaq mayuta rikapakun, imaypis wiñanqanta watarkur watarkur. Paniiwan ishkaa aywapakurqa rikaq, patsa hunaqyaptin, chay yaku shuntakaqman, kananqa qanra, yanayashqa aywaykan chay chaka (tsaka) kanqanpa. Chaychaw kapakurqaa chay uurakama chayta rikar. Chaypita qiqapakurqaa chay huchumushqapa mayayta munar, ima rimaqta runakun. Urachawqa chay may kaqchaw manami mayakantsu runapa shimillanmi rimaq rikakun, imatapis ninakuq kaynaw mana mayakar. Chaymi hiqapakurqaa chay huchumushqapa, chaychaw runa kaykan mayuta rikar, willapaanakur mayu ima ruranqantapis. Chaychawmi musyapakurqaa mayu apanqanta, chay serpentina waakata; Chay waaka paniipami kanaq. Chaytami, taytaa panii Tachata santun hunaqpaq quykunqanmi, waakan, yuraq rinrin, muru-muru shumaq ñawiyuq kanaq. Chaytapis mayu aparkunaqpis. Manami imanaypapis musyaytsu chay serpentina waaka, mayu pasanqanta, mana musyaq niraq yaykurqan chay mayupa, mana riqir niraq, waranwaran puriykar. Chay serpentina waaka, manami karqantsu imaypis ayrallashqalla. Chay waaka, puñuykarchi aywarqan chaynawllapa wañuchikunanpaq. Ñuqaqa, achka kutimi richkachirqaa (riyachirqaa) chikupa punkunta kichar. Manami chaynaw kar, chayqa chaychawchi puñukunman, quyaytapis qimchiraakur, shumaqlla ayachakur, waakakuna puñur ayachakuq niraqrami. Kaychawchi puñukashqa karqan, yarparqan lasaq yaku waqtanman chaayar, rikchachinantaraqchi chawraq, chaychawchi manchakar kutiyta munarqan: Chayraq kuntinqanchaw tinkukarqan chay qanra, yana yukuwan tawqikashqa, watakashqa huyu chukru yana parpu (wanku) kuyuykaq niraqchaw. Yanapamay nirqachi, yanapamay ninqanta, kamakuq taytallanchi musyan. Ñuqa tapukurqaa huk runata; manatsuraq rikarqayki mayu apanqanta chayllachaw waakallatawan. Chawraq (chayraq) nimarqan mana musyaatsu rikanqaatapis. Waakallashi pasarqan chakin wichan paqashqa, chayllanpa chawraq chaychaw kaykanqanpita, muyurkunqankamaqa mananashi rikarqannatsu waqrantapis, chakintapis, imatapis. 131 Mayunpashi kuchpar aywarqan hatun qinwa qirukuna sapintin (watsuntin), wakin yantapaq hurquychawshi kakurqan awsay awsar, mana rikar, uywatatsuraq qirutatsuraq apakurqanpis. Chaynawllapami mana musyapakuqtsu mayutsuraq aparqan, mamanpa qipantatsuraq mayullanpa aywashqa, chaynaw kaptinqa, kamakuq taytallanchi ishkanta shumaq rikaatsun. Wasichaw imapis wayralla kaykaptin imapis wara kananpami, kananshi panii Tacha hinaylla rikakarqun. Taytaa shumaq arurkur qurqan chay serpentina waakata, ichik waakalla kanqanpita paniita qunanpaq, charananpaq ichik qullqillanta, mana wakin hatun panikuna niraq, aywakarinanpaq. Taytapitaqa, paykunaqa, manashi shumaqnatsu kapakurqan wakcha wasichaw kawar, maypapis kacharqan, ichikllanpitashi kapakurqan mana mayakuq. Chawraq wiñarkurqa runawan purikurirqan munanqankunawan. Tukuy rurayta yachakur chaykunawan, paykunaqa shumaq yacharqan, chaymi chaykuna musyanakurirqan, qayakamuptin paqaskunapa, hunaqpa aywananpaq. Imay uura mana aywarkaqtsu yakuman mayupa, chaymi mana musyaywan chay chikuchaw karqan, pampachaw quchpaykar, llapan achpanakushqa runanwan hananakushqa. Chawraq taytaa ishkanta qarqurqan, ichikllataqa kuyaparqanraqmi, llapan ima rurapakunqantashi: chaypita chikallamanqa mananami kuyaparqannatsu, chay uura qarqurqan. Niykur paykuna aywakarirqan, chay ayuta markapashi, pitaq musyan maypashi, tukuyta rurarchi purirkanqa. Chaymi tukuy rimay taytata pinqakachin, kananqa panii Tacha, mana munantsu kananta, wakin nanankuna hina, chayta musyar hinaylla waakaanaq rikakanqanpita mana imatapis ruranqanatsu, wiñachinqannaw tiyakunanpaq huk alli runawan, munananpaq llapan kawayninchaw. Chaymi kananqa mana allitsu kanqa. Waakanwanqa huknawmi kanman karqan. Chayta rikarqa manami pipis ama ninmantsu karqan tiyayta, apakunanllapaqshi chay kuyayllapaq waakallanta. Alli yarparayqa kaykannatsu, ichik waakallanchik kawarqa kawaykan, alliraqchi kanman, mana maman mayu pasaq qipanpa yakushqa kaptinqa; yaykushqa kaptinqa, pani Tachaqa kaykan ichikllapita purinanpaq tukuyta rurar. Mamaqa chayta munantsu. 132 Mamaqa manami musyantsu, imanir tayta kamakuq chaynaw nakachinqanta, chaynaw wawankunata qur, ayllunchawqa awilanpitapis manashi chaynawtsu kapakurqan huyu runa, llapanshi uywachikarirqan tayta kamakuqta manchakur, mana pitapis tukuyta rurapar, llapan kapakurqan chaynawlla. Pitaq musyan, maypitaraq shapakamurqan chay wawankuna tukuy ruraq pipapis. Payqa manami yarpantsu. Yarpachakun lampanta, huyu rurayta, mana rikar, ima huchapita. Chay wawankuna chayniraq tukuy ruraq yurinqanta. Mana yarpantsu, chaykunapita yarpachakur waqar nin: “tayta kamakuqlla, shumaq rikaatsun”. Chaymi taytaqa nin chaykunapaqa mananami hampi kannatsu. Huyu niraq kaykan kaychaw, Tacha, qiru hina wiñaykan, chuchunpis wiñarqun nanankunapa, hina hatun puturaykan (chikpiraykan) maychawpis rikarakarinanpaq niraq. Pitapis rikanqantaqa haqinqashi ninmi, maychaw rikaptinpis. Manachi allitsu kanqa. Rikaa mana alli kananpaqmi. Chaymi kaykan taytapa hamurpachikuynin. Tacha waqan mayu waakanta wañuchinqanta musyar, manachi rikanqanatsu. Kaychawmi kaykan, kayllachawmi qamya (qamla) puka llatapashqa nir, mayuta rikaarir, chay huchushqakaqllachawmi waqan mana chawayllapa, uyanpaqa qiqarpamun qanra yaku niraq aywan, qanra mayu yaykushqa niraq. Ñuqa markaakuu shuqananpaq, payqa manami mayakuntsu. Huyuparami waqayta qallaykun, shiminpita yarqamun mayu arashchaykaq, hina chaymi katataykar (tsuktsukyaykar) kakun, chayman hinalla charpaykamun yaku ayqaqqa. Chay ismu asyay chaayaamun pillchipa pillchir, karupita uyanta ushmar, chuchunpis hanaman, uraman shuqshikan, mana ichiykullar, arunanpaq niraq chay llapan uqranqanpita."
Imanawpami qishqi shillunkunata tar shillunkunata tarirqun,"Kay willapaqa kaykan unay pitanami, taqay shalanlan (chakin) tuna qaqachaw, rumi huntachaw manashi ima qiwapis rikakaqtsu. Chaychawmi wiñarqan huk ata qishqi, chayshi mana kashayuq kanaq, kanan charashqannaw. Mana ima shutu yakupis kaqtsu chaychaw, chaymi mapula (yanqalla) tamya rataq, qishqi quyullami rikakaq. Ruri chawpinchaw yuraq hunta yaku rikakaq; ñampu qarayuq kaq. Chaymi shumaq warawayarqa rikakaq purinakunachaw, rikarishqaqa alli kallpayuqmi tarikaq. Waran waranmi chaypa achka llamakuna, wikuñakuna, paqukunapis (alpakakunapis) yakunay kaptin puriyaq, ashuykariqshi qishqiman, niykur rapranta munashqanpitami waqrupakuq. Ushapakuq yakunta llapan mallipakunanpaq; chaymi nanaywan maakushpami kayninpami niq: —¡Imayuqpis kaptiiqa, kay uywakunapa kirunpita washaakunapaq! Qishqishi chikallaman (chisillaman) hawkan taq; witsanpita mayanaq qaqa qaparir aywaykamunqanta. Hanaman rikaarinaq, chayshi rikarqan atuqta, wayralla yarpuykaamuqta, hatun kuchpawan qatinakurinaq. Rumishi puntata aywanaq, qipantanashi atuq anchaypa anchar qatinaq. —¡Manami llallimankitsu! Qapariq atuq. —¡Mana kaq waqwa; mananami taripaytaqa taripaamankinatsu; qalluykipis aqtukashqanami kaykanki! —Rumishi kutichinaq. Chayshi rumi, muyurir, tikrarirshi qaqa chawpinchaw kuchpanaq; chayllashi rumi yarpunaq; qipaman shuyunakuq mayinta haqirqan. Qishqi, mana imatapis mayaqtukuqshi; qishqi, yarpachakuykaanaq, chayshi payta qapachakuqtashi mayanaq: —¡Tiyu qishqi, tiyu qishqi! Muyunaqshi kaypa, wakpashi; qapariqta rikachakur. —¡Tiyu qishqi, tiyu qishqi! Shumaq yarpachakunaq, chayshi atuq qaparishqanta musyarqan. 134 —¿Imatami munanki? —Tapunaq qishqi. —Tiyu qishqi ¿Yanapamankimanku? —Makichaw kaptinqa… ¿Imanashqankimi? —nirqaa. —Ama chaynaw kaytsu, chay rumita kuchpaykamuqta harkay ari, chaypitami ñawinchashqayki (ñawinpaakushqayki). —¿Imatami qumanki? Tapunaq qishqi. —Munanqaykita qushqayki. ¿Imatataq munapaykanki? Qishqi, hana patsaman rikaarir, yarpachakunaq. —¿Imatami manashaq? ¿imatami munaykaa? Kikin tapukunaq. Rasllami achikyay yupay umanman charqan. —¡Shillutami!... ¡Shillutami washakunaapaq, llamakunapita, wikuñapita, paqukunapitapis (alpakakunapitapis) chayta munaykaa. Uywakunami waran waran ñuqaman shamun waqrapaamananpaq, mananami turyapamaananpaq —Ninaq. —Shilluykita munaa, washakunaapaq. Qumankiku aw manaku. ¿Qumankimantsuraq? —Allichi… Chawrasqa yanapashqaykimi —chayninpami kuyay shiminpa atuq nirkunaq. Rumishi kuchpaykarqan kayman, kayman sharkamur; kuchpaq kuchpanaq. Qishqi, shuyararqan ashumunanta (witimunanta). Naqana ñawpanchaw kaykaptin karuta mashtarqan yurankunata; makiwan yupaypis harkarqan chanay chanay makallapakushpami. Nishqankama atuq qishpinaq, rumi kashqankaqpa. Chaymi ukakashqa karqan, mana kuyukuypa. Chaynawmi atuq chayaanaq qaqa chakinman. Chay tupunakuyman chaayar. Chayman chaarirqa llapan kallpanwan qapachakuyta qallaykurqan: —¡Rumi, mana kaq rumi, llallirquqmi! Huk kaqqa uchakuykarqan kachakaananpaq, qishqi chipi-chipi (chachaq chachaq) chararaykarqan. 135 —¡Amaraq kachaykuytsu, tiyu qishqi! —Mañakuq atuq, shuyaykuyraq. Alli kashqakama, taripamarqan, pichuytami (paltashtami) ruramanqa, llapchimanqa huklla wañuqpaqmi. ¡Yusulpaakuy! Chayta nirkur, huklla wayralla hacha kaqpapis, yaku kaqpapis aywanaq, machay rurinman pakakunaq. Achka hunaqnaqshi pasanaq, chayshi qishqi, atuq alli kashqanta yarpaanaq; chayshi rumita mallqaraykashqanpita kacharirkunaq. Tukuyta qayaparkushpami rumi aywanaq qaqa waqtanpa. Mayinipitashi qishqi huknaw rikakukunaq. Kikin mayapakurqan yurankunachaw, achka kasha winaykaqta atuqpa shillunnaw. Chayta rikarkushpami kushishqaman tikrarqan, llapan kallpanchaw kasha wiñaptin. Chayshi waqanaq; kananpita manami pipis imatapis ruramanqatsu, ninaq. Chay hunaqpita, atuq, qishqinaw yanasaman tikrapakunaq."
"Imanawpa, Jíbaros nishqan ninata taripakurqan","Willakarin, ninatashi taripakunaq, unay patsa, unaynashi, imanawpa taripakunqan, mana tarinqanpis musyakantsu willakaramunanpaq. Kashqa unaynami, manaraqpis Amazonas mayu rikakamuptinraq. Chay unay karu patsachaw, Jíbaro runakuna, chawa-chawa, sachakunapa murunta mikupakuq. Kalawasakunata, chaki murukunata, sachakunata, yunkapa uywankunata wañuchipakuq, mayupa challwankunata, urpikunatapis, tuqlla (trampa) rataqman charipakunaq. Chay mikuyshi alli kanaq. Wayukunapita (luklikunapita) tsaki murukunata ima allishi kanaq. Aychapis allishi kanaq, chayta mikapakuptinshi pachankuna amata hakaramunaq. Chay patsa tsaqaqchaw, killa mana yarqamunqanchaw, atipayaachiq amakachaw puñupakunanpaq, manaraqpis inti hiqaykaptin. Patsa waraamuptinnaaqa, tuta-tutalla wasinkunapita yarqapaakamuq aruq. Chaynawllashi Jíbaro runakunapa llakikuyllapaqshi muyuq kawayninkuna. Huk hunaqshi, hatun hachakunapa hananchawshi, rikapakunaq achikyaqta. Chaychawshi, huk runa warminwan yachanaq. Paykunallashi ninata chararapakunaq. Taquea —Jíbaro runapa, warminpa shutin kanaq— warmishi mikuyninta alli yanuchiq. Yukata shumaqshi shanshachaw yanuchiq, aychatapis puwachiqshi. Patsa tsaqaptin manashi llantunaqnatsu, chillapyanaq, Chaska quyllur achikyanqan yupayshi achikyaanaq. Ichik chuspikunapis rikakaqshi, hatun felinos nishqanpis, manashi ashuykariqtsu. Ayqikariqshi, ninata achikyaqta rikaykur. Huk patsa Taquea, huyupa tamya paskakanqanchaw chakranta, shapashta, purutukunata (pushpukunata), yukatapis hurquq aywanaq. Chay mikuykunata hurqunaq ninawan yanukunanpaq (arunanpaq). Qucha naanipa kutiykamuptinnashi ichik hirishta (winchusta) mana pawaytashi atipaqtsu, hirish patsaypa ushmashqa kaykaanaq, chaytashi rikaanaq. Taquea, ichik hirishta rikar llakikurqun, kikintashi ninakuq: —¡Hirishllaw, pishqullaw!— wasiman apakushaq ninaq. Paqta imallatapis payraykur ruraaman. Achka llapan kuyakuyninwanshi, chuchunmanshi chipiy chipiy apanaq. Taqueata, unaypitanashi, hirish pawaptin munapaq. Kay pishqukunashi pawapakuptin, rikrankunawanshi patsachaw, shumaq takyachikariq waytapa hanankunachaw, niykur tupshanwan mishki yakuta shuqupakunaq. 137 Wasinta chaykurna, Taquea tantiyanaq; ninapa shanaynin ichik hirishta kawarachimunqachi niq. Chaynawmi kanaq: Ninapa shanaynin ishkan rikrankunata tsakichinaq, pishquqa allinashi rikakuq, hirishpa rikrankunapis kallpayuqnashi kanaq. Pishqushi kawariramunaqna, chayshi rikrankunata, tupshantapis tapshinaq. Amata (allaapa) hirish kushinaq, niykur nina hananman, shansha hananmanpis quchpanaq. Chayshi, manashi ninaman yaykuykaqta rikaarirqatsu. Chayshi, ishkan rikran ninawan achkiykunaq, chupanpis achkinaqshi, niykur hirish hacha-hachakunapa pawayta (paariyta) qallaykunaq. Pishqushi hanapa patsaypa qushtarir aywanaq. Paway, pawayta aywanaq, chupanpis nina achkishqa yupay karupita rikakuq. Karuta aywaykaptinnaaqa, hatun tsaki hachapa hananmanshi shaaraykunaq, chayshi ichik nina chupanpita ratanaq, kay tsaki hacha chayllachawchi achkiykunaq. Jíbaro runakuna chakrankunatashi arupakuykarqan, chayshi karuta yana qushtanqanta rikapakunaq, yana pukutay niraqshi rikakuq, hana hanatashi rikakuq, niykur hacha hachapa llapan aywayarqan rikaq. ¡Ninashi llapanpa rupaq! ¿Imaraq kashqa?. ¿Maypitaraq nina yarqamushqa? Llapan yarpachapakunaq. Musyayninkuna chayllachaw kaykaanaq: nina rupanqanllachawmi kaykaanaq, hirishpa plumankunapa rupanqan rikakaqranmi. Chaypitami Jíbaro runakuna kanankama ninata chararapakun, chaywan paqaspa achikyakarin, killa mana yarqamuptin, hunu uywakunata manchachipakunanpaq, chaywan achikyaarachiyan. Chaykama rimapakun, qutsupakun, tushupakunpis ninapa chawpinchaw. Ninawan llapan mikuyta yanukuriq, chaypinashi yukata, sapashta, purututapis yanukarin; shanshachawpis aychata yanuchipakun, mayu challwakunatapis yanukuriqshi. ¡Shumaqshi mikapakunaq!, ¡yukapis, ichiq yuraq yakun yarqamunqankamashi yanukaq; challwakunapa tullunkunapis shumaqshi yanukaq! Hirish nina apamunqanpita, Jíbaro runakuna rimarqaarinaq pishquta kawachipakunanpaq; kay pishqupa kanankamami chupan nina kayashqa yupay rikakun; hirish chayta munarpis, mana munarpis apaykunaq, manashi chayllatsu, ¡Hirish apanqanwan, shanaytashi apanaq alli kawapakunanpaq!"
Hatunkaray charapa,"Unayshi, Buenos Aires markachawshi, huk runa kushishqa yachaq; payshi alli kaykaanaq, allaapa arukuqpis kanaq. Huk hunaqnashi qishyaqman ratanaq. Hampikuqkuna runa hampiykunanpaq, karu chakrantashi aywananpaq nipakunaq. Payqa manashi munaqtsu aywayta. Wawqinkuna takshallashi kapakunaq; paykuna mikunanpaq aruq. Patsa aywakaptin qishyaq runaman tikranaq. Chayshi, huk ullqu yanasan, Director del Zoológico nishqan, ninaq: —Qammi yanasaa kanki, alli shunqu runa, alli arukuq, chayraykurmi ñuqa yunka patsaman aywanaykitami munaa. Chaychawmi qam alliyaamunki. Qamqa alli makiyuqmi kanki, illapawan uywakunata wañuchiy, niykur qarankunata ñuqaman apamunki, chayraykurmi ñuqaqa qullqitami qushqayki, mana wawqiykikuna mikuynin kananpaq. Qishyaq runa aaninaq. Niykur yunka karu patsata yachaq aywanaq; karutashi aywanaq, Misiones nishqanpita karutashi aywanaq. Chaychawshi amata rupaq, chayshi payta alliyaachimunaq. Yunka patsachawshi kikillan yachanaq; kikinshi yanukuq. Pishqukunatashi, wakin uywakunatapis illapawan wañuchinqankunata, tsaki muruta mikuqshi. Hatun hachakunapa urallanchaw puñuqshi. Tamyaptin raatullashi hachakunapa raprankunawan wasinta sharkachiq. Niykur chapakuq, kushishqa hachakunapa chawpinchaw tamyawanpis waraq. Uywakunapa qaranwan huk qipitashi ruranaq, niykur rikranman apakuykunaq. Charinaqshi katarikunata (víboras nishqankunata) kawaykaqtashi, chaytashi hatun matiman apanaq. Kirusini laata winaraq yupayshi mati kanaq. Qishyaq runa alliyaramurqanshi achka kallpayuqshi kaykaanaq; allitashi mikunaqpis. Huk hunaq mikuyanaqtsu, ishkay hunaq mananashi imatapis charinaqtsu; chayshi mama quchapa kuchunchaw, huk hatunkaray tiqrita rikaanaq; payshi charapa mikukurkuyta munanaq. Tiqrishi charapata ichichiq (shaaraachiq), niykurshi shillunkunawan ashpiq aychata hurqunanpaq. Tiqri runata rikaanaq, chaynashi runapa hananman aywaykunaq. Runaqa illapawan umanta (piqanta) tuquykunaq. Niykur tiqripa qaranta hurqunaq. Hatunkarayshi kanaq; chayshi alli kaykaanaq, hatun wasiman mahapakunanpaq. 139 —Kananqa charapata mikushaq; chaypa aychanshi mishki aychashi kanaq. Charapaman witirkuptinashi, mana alli kashqanta rikaanaq. Umanpis warkuraykaanaq ichik aychakunallashi kunkanpita chararaykaanaq. Amatashi mikunaykaanaq. Runa charapata llakiparqunaq, niykur waskawan qarashtaypa charapata aparqun. Niykur ichik ramadaman chacharaachirqun; umanta wankukunawan wankurqun. Charapata qaraschaypa, qarashtaypa aparkunaq, charapaqa hatunkaray, tiyana niraqshi kanaq. Lasaqta sutarir ramrash wasinman apanaq, utkuta hurqushqa kamisanpita, niykur umanta wankushqa, mana imapis kanaqtsu, kamisanllata chararaayashqa. Shuutarir apashqa charapata hatun kaptin, hatun chapakuna niraq runanawshi lasaq. Charapata huk kuchunllachawshi witichinaq. Chaychawshi mana kuyurlla charapa kanaq. Runashi hunaq-hunaq charapata hampiq, niykur washanman, ichik makinwan wiruq kuyapayllapa. Charapaqa kachakaanaqnashi. Chaypita runanashi, qishyaqman tikrarkunaq. Amatashi shanaykanaq, ima aykanpis nananaqshi. Chaypitana runa manana sharkurqanatsu, llapan kikinpa imankunamanpis amata shanaq, yakunaypita kunkan rupanaq. Runa tantiyarkunaq, mana alli kanqanta, niykur kikinlla rimaq. Quyupa uman shanariq. —Wañushqami runa ninaq. Kikillaami kaykaa, mananami atipaanatsu sharkuytapis; manami piyniipis kantsu, yakuta qumaananpaq. Kaychawmi wañushqa mikunaypita, yakunaypitapis. Raatullanman runa huyupa shanariqna, chaynashi mana tantiyanaqnatsu; shunqun pitinakunaq (upasakanaq). Charapa mayashqa kashqa, llapan runa rimanqanta tantiyanaq. Charapa yarpachakurqun: —Mana alli kaykaptii, kay runa, manami mikamashqatsu, hampimashqapistsu: kanan ñuqaqa payta hampishaq —kikillan rimaq. Mama quchaman aywanaq, ichik charapa qaranninta ashishqa, niykur aqu allpawan, shanshawanpis mayllaykurna yakuta apanaq. Niykur runata upyachimunaq. Hakunman wikaparaqta, runa yakupita wañuyaqta. Chayllaman ichik mikukuq sapikunatashi (sipikanatashi) ashinaq; yuyukunatapis, chaykunatashi runa mikunanpaq apanaq. 140 Runa mana musyar pi qushqantapis mikuylla mikuq. Runashi muspaylla muspaq, shanariyninpita manami pitapis riqiqtsu. Patsa waramuptinna, charapa hatun hachakuna mishki sapikunata ashiq runata mikuchinanpaq. Paymi llakikuq hatun hachakunaman, mana yarquyta atipaq, wayukunata apananpaq. Uywa wañuchiq runa waran waran mikuq, mana musyashpa pi mikachinqantapis; huk hunaq runa yarpachakurqun. Kaypa wakpa rikachakunaq. Kikillan kashqanta rikaanaq. Chaychaw manashi pipis kanaqtsu, charapallashi paywan chaychaw kaykaanaq. Hukpita huyupa rimarqun: kikillaami kay hachakunapa chawpinchaw kaykaa; chay shanay qishya yapay kutimunqa. Kutimuptinqa kaychaw wañushaq. Buenos Aires markachaw alli hampikuna kan. Mananachi imaypis kutishaqnatsu, kaychawchi wañushaq. Pay nishqan yupay, chay hunaq, qishya kutinaq, huyu huyupaqnashi shanarinaq, hukpita yarpayninta uqranaq. Charapa yapay llapanta mayanaq. Kikin ninakuq: —Kaychaw kay runa karaptin wañunqami ninaq. Kaychaw manami hampi kantsu, Buenos Aires markatami apashaq. Chayta niykur, alli waska niraqkunata kuchurqun, niykur, shumaqllapa shumaqllapa runata washanman chacharirkunaq, niykur chipi-chipi (allaapa chaqra) wataykunaq mana ratananpaq. Shumaqmi washanchaw illapata uywakunapa qarankunaman churakuq, niykur illarqun. Charapa chaynaw qipishqa aywaq-aywaq; hunaqpa, tsaqaypapis. Hachakunapa chawpirqun, hachakunapa chawpinpa, hatun mayukunata chimpanaq, qucha-quchapa pampa shaaniraqtapis chimparqun. Runa wañuyqanta qipishata aywaq. Chayshi pusaq patsana, chunka patsanapis, aywanqanpita shaykuq. Hukpita llapan kipunqanta paskarinaq, niykur runata chachaykachinaq tsaki qiwaman. Yakuta ashiq, llullu sapikunatapis ashiq, niykur qishyaq runata mikachiq. Kikinpis mikuq. Patsaypa utikashqa kaykaanaq, chayshi puñukuq. Wakin hunaqchaw inti amata shanayaptin aywaq. Usyaq patsa kanaq, runa nuspayllashi nuspaq. Amata (allaapa) yakunaachikunaq. 141 Qapachakuq: ¡Yaku!, ¡Yaku! Yapay, yapay qapariq. Charapa yakuta quq. Chaynaw aywanaq waran-waran. Buenos Aires markata chaykarirqanami, charapapa kallpanshi ushakaanaqna. Aywanqanchaw uchanshi mananashi kanaqnatsu; hunaq aywaptinnashi, charapa mana alli aywaq. Kallpan ushakayashqa kaykaptina, pampamanshi mashtakaq, patsaypa utikashqa. Chaynashi runa hukpita riqchanaq, niykur huyupa rimaq: —Wañushaqmi mana alli kaykaa. Buenos Aires markachawllami hampikushaq, kay hachakunapa chawpinchi wañushqa. Runashi yarpaanaq, ramada kanqanta mana imatapis tantiyaqtsu. Chaynashi charapa hukpita sharkuq, niykur huk aywaq. Huk hunaq, inti hiqaykaptinna, llakikuypa charapaqa mananami aywayta atipaqnatsu. Amata pishikarkunaq, mananami aywayta atipaqtsu. Charapa simanata manami mikurqatsu, yanqa chanapa nir. Llapan kallpan ushakaanaq. Patsa tsaqaykaptin, karu chimpachaw ichik achkiyashqata rikaanaq; chaynashi hana patsa chillapyanaq, mana musyaqtsu ima kashqanta. Manashi uchan kanaqnatsu; niykur ñawinta wichqarqun, runawan wañunanpaq. Yarpachakuqshi llakishqawan runa mana yanapanqanta; alli runata mana kaway intushinqanpita. Buenos Aires markachawnashi kakunaq, charapapis mana musyaqtsu chay achikyaramunqanta, hana patsamanshi hatun markapa chillapyaqninshi kanaq. Markatashi chaykarinaqna. Chayshi huk ukush, Pérez shutiyuq ukushshi, ishkan illakuqkunata tarinaq. ¡Yaa charapa! —ukush ninaq! Manami imaypis hatun charapata rikashqatsu. ¿Imami kan washaykichaw apayanqaykichaw? ¿Yantatsun? —Manami —Charapa llakikuy niraq kutichirqun. Huk runami kaykan. —¿Maytataq chay runawan aywaykanki? —Musyaq tukuq ukushi ninaq. —Aywaykaa… Buenos Aires markatami, aywayta munaykarqaa —ninaq Charapa patsaypa wañuyaykarnami. Wañupakushqami kaychaw, manami imaypis chaashuntsu. —¡Upa, upa! —Ichik ukush asikur ninaq—, ¡Mana imaypis upa charapata rikarqatsu! ¡Buenos Aires markachawnami kayanki! 142 Chimpa achkishata rikaykankitsu, chaymi Buenos Aires marka. Chayta mayarkur, charapa hukpita kallpachakurkunaq, patsa kaykarashqarami hampichinanpaq, hukpita aywanaq. Patsa mana waramuptinraq, Jardín Zoológico umalliqnin, charapa chaykunqanta rikaanaq. Payshi aqrayashqa, patsaypa utikashqa chaanaq. Washanchaw chacharashqa yanasanta apamuq, Umalliqqa yanasanta rikaykurqan, kikinshi hampi ashiq aywanaq, chayshi yanasan hampi apamunqanwan hampinaq. Runa alli kaykaptinnaaqa, musyarqun imanawpa charapa chaachimunqanta, runa hampikunanpaq. Chayshi charapa kimsa pachak leguas nishqantashi aywamunaq. Runashi chaypita mana charapata haqinaqnatsu. Wasin manashi charapata charananpaq aypaqtsu, chaynashi Zoológico nishqan umalliqnin apakunaq, warmi churinyupaq kawachinanpaq. Chaynaw charapa kushishqa yachaq, amatashi kuyapakuq zoológico nishqanchaw. Chay charapatami zoológico nishqanchaw kanankama rikanchik. Paytaqa makisapakuna muyuripakun. Runa, waran-waran hunaq, charapata rikaq aywan. Payqa yanasanta karupita aywanqamuptin riqin. Ishkay patsan, ishkallan puripakun. Charapa mana runa aywakunanta munantsu. Aywakunanpaq mashanman kuyapan niykur ichik wiruykun."
